{
  "v": "1.0",
  "id": "01JB5VQ0000000000000000126",
  "seq": 126,
  "ts": "2026-09-29T09:42:06.000Z",
  "world_id": "w_village_basic",
  "run_id": "r_village_basic_1",
  "type": "connection.established",
  "actor": "system",
  "target": "I3",
  "level": "L1",
  "district": "D1",
  "item": null,
  "severity": "info",
  "credits": 0,
  "summary": "Google Drive is connected.",
  "cause": null,
  "vis": "all",
  "authz": null,
  "data": {
    "connector": "google_drive"
  },
  "trace": {
    "model_role": null,
    "profile": null,
    "tokens_in": null,
    "tokens_out": null,
    "tool": null,
    "latency_ms": null,
    "archive_ref": null
  }
}
