{
  "v": "1.0",
  "id": "01JB5VQ0000000000000000013",
  "seq": 13,
  "ts": "2026-09-29T09:30:36.500Z",
  "world_id": "w_village_basic",
  "run_id": "r_village_basic_1",
  "type": "agent.spawned",
  "actor": "A_dir",
  "target": "A_l1",
  "level": "L1",
  "district": "D1",
  "item": null,
  "severity": "info",
  "credits": 0,
  "summary": "A Lead joined the team for Mail.",
  "cause": "01JB5VQ0000000000000000012",
  "vis": "all",
  "authz": null,
  "data": {
    "role": "lead"
  },
  "trace": {
    "model_role": null,
    "profile": null,
    "tokens_in": null,
    "tokens_out": null,
    "tool": null,
    "latency_ms": null,
    "archive_ref": null
  }
}
