{
  "v": "1.0",
  "id": "01JB5VQ0000000000000000116",
  "seq": 116,
  "ts": "2026-09-29T09:41:56.000Z",
  "world_id": "w_village_basic",
  "run_id": "r_village_basic_1",
  "type": "agent.context_handoff_started",
  "actor": "A_s1",
  "target": "A_s1",
  "level": "L1",
  "district": "D1",
  "item": {
    "kind": "backpack",
    "artifact_id": "art_handoff_note",
    "label": "Handoff note"
  },
  "severity": "info",
  "credits": 0,
  "summary": "The Specialist wrote a handoff note at 70% of its context.",
  "cause": null,
  "vis": "all",
  "authz": null,
  "data": {
    "note": {
      "artifact_id": "art_handoff_note",
      "version": 1
    },
    "context_pct": 70
  },
  "trace": {
    "model_role": null,
    "profile": null,
    "tokens_in": null,
    "tokens_out": null,
    "tool": null,
    "latency_ms": null,
    "archive_ref": null
  }
}
