{
  "v": "1.0",
  "id": "01JB5VQ0000000000000000012",
  "seq": 12,
  "ts": "2026-09-29T09:30:34.500Z",
  "world_id": "w_village_basic",
  "run_id": "r_village_basic_1",
  "type": "world.started",
  "actor": "A_dir",
  "target": "w_village_basic",
  "level": null,
  "district": null,
  "item": null,
  "severity": "info",
  "credits": 0,
  "summary": "Work started with a budget of 40 credits.",
  "cause": "01JB5VQ0000000000000000004",
  "vis": "all",
  "authz": null,
  "data": {
    "budget_cap": 40
  },
  "trace": {
    "model_role": null,
    "profile": null,
    "tokens_in": null,
    "tokens_out": null,
    "tool": null,
    "latency_ms": null,
    "archive_ref": null
  }
}
