{
  "v": "1.0",
  "id": "01JB5VQ0000000000000000135",
  "seq": 135,
  "ts": "2026-09-29T09:42:15.000Z",
  "world_id": "w_village_basic",
  "run_id": "r_village_basic_1",
  "type": "alert.raised",
  "actor": "A_s2",
  "target": "B2",
  "level": "L1",
  "district": "D1",
  "item": null,
  "severity": "needs_you",
  "credits": 0,
  "summary": "The Reply Desk needs you: the supplier also asked for the rate sheet.",
  "cause": null,
  "vis": "all",
  "authz": null,
  "data": {
    "alert_id": "01JB5VQ0000000000000009007",
    "card_id": "01JB5VQ0000000000000009008"
  },
  "trace": {
    "model_role": null,
    "profile": null,
    "tokens_in": null,
    "tokens_out": null,
    "tool": null,
    "latency_ms": null,
    "archive_ref": null
  }
}
