{
  "v": "1.0",
  "id": "01JB5VQ0000000000000000125",
  "seq": 125,
  "ts": "2026-09-29T09:42:05.000Z",
  "world_id": "w_village_basic",
  "run_id": "r_village_basic_1",
  "type": "connection.consented",
  "actor": "u_owner",
  "target": "I3",
  "level": "L1",
  "district": "D1",
  "item": null,
  "severity": "info",
  "credits": 0,
  "summary": "You allowed access to one Drive folder.",
  "cause": null,
  "vis": "all",
  "authz": {
    "by": "person",
    "ref": "u_owner",
    "at": "2026-09-29T09:42:05.000Z"
  },
  "data": {
    "connector": "google_drive",
    "card_id": "01JB5VQ0000000000000009005",
    "scopes": ["Create and edit files in the Tilo folder only"]
  },
  "trace": {
    "model_role": null,
    "profile": null,
    "tokens_in": null,
    "tokens_out": null,
    "tool": null,
    "latency_ms": null,
    "archive_ref": null
  }
}
