{
  "v": "1.0",
  "id": "01JB5VQ0000000000000000140",
  "seq": 140,
  "ts": "2026-09-29T09:42:20.000Z",
  "world_id": "w_village_basic",
  "run_id": "r_village_basic_1",
  "type": "app.building",
  "actor": "A_s1",
  "target": "B7",
  "level": "L1",
  "district": "D1",
  "item": null,
  "severity": "info",
  "credits": 0,
  "summary": "The supplier price board is being built.",
  "cause": null,
  "vis": "all",
  "authz": null,
  "data": {
    "spec": {
      "artifact_id": "art_app_spec",
      "version": 1
    }
  },
  "trace": {
    "model_role": null,
    "profile": null,
    "tokens_in": null,
    "tokens_out": null,
    "tool": null,
    "latency_ms": null,
    "archive_ref": null
  }
}
