{
  "v": "1.0",
  "id": "01JB5VQ00000000000000WEB01",
  "seq": 4,
  "ts": "2026-10-16T09:30:05.000Z",
  "world_id": "w_village_basic",
  "run_id": "r_village_basic_1",
  "type": "plan.maker_chosen",
  "actor": "u_owner",
  "target": "w_village_basic",
  "level": null,
  "district": null,
  "item": null,
  "severity": "info",
  "credits": 0,
  "summary": "You picked Lovable to make the website.",
  "cause": "01JB5VQ00000000000000WEB00",
  "vis": "all",
  "authz": null,
  "data": {
    "deliverable": 0,
    "title": "Store front with sign-in",
    "format": "website",
    "make_with": "connector:lovable",
    "label": "Lovable",
    "suggested": "connector:lovable"
  },
  "trace": {
    "model_role": null,
    "profile": null,
    "tokens_in": null,
    "tokens_out": null,
    "tool": null,
    "latency_ms": null,
    "archive_ref": null
  }
}
