{
  "v": "1.0",
  "id": "01JB5VQ0000000000000000991",
  "seq": 1,
  "ts": "2026-10-15T09:00:00.000Z",
  "world_id": "w_desk_ravi",
  "run_id": "r_desk_ravi_1",
  "type": "invite_link.accepted",
  "actor": "u_ravi",
  "target": "u_ravi",
  "level": null,
  "district": null,
  "item": null,
  "severity": "info",
  "credits": 0,
  "summary": "Ravi joined a team through an invite link.",
  "cause": null,
  "vis": [],
  "authz": null,
  "data": {
    "invite_id": "til_0a1b2c3d4e5f60718293a4b5",
    "team": "tm_5f3a9c2e7b1d4e6f8a0b2c4d"
  },
  "trace": {
    "model_role": null,
    "profile": null,
    "tokens_in": null,
    "tokens_out": null,
    "tool": null,
    "latency_ms": null,
    "archive_ref": null
  }
}
