{
  "v": "1.0",
  "id": "01JB5VQ0000000000000000131",
  "seq": 131,
  "ts": "2026-09-29T09:42:11.000Z",
  "world_id": "w_village_basic",
  "run_id": "r_village_basic_1",
  "type": "artifact.versioned",
  "actor": "A_s2",
  "target": "art_reply_draft",
  "level": "L1",
  "district": "D1",
  "item": null,
  "severity": "info",
  "credits": 0,
  "summary": "The reply draft has a new version after your edit.",
  "cause": null,
  "vis": "all",
  "authz": null,
  "data": {
    "artifact": {
      "artifact_id": "art_reply_draft",
      "version": 2
    },
    "previous_version": 1
  },
  "trace": {
    "model_role": null,
    "profile": null,
    "tokens_in": null,
    "tokens_out": null,
    "tool": null,
    "latency_ms": null,
    "archive_ref": null
  }
}
