{
  "v": "1.0",
  "id": "01JB7A0000000000000000E045",
  "seq": 45,
  "ts": "2026-10-16T10:00:45.000Z",
  "world_id": "w_village_basic",
  "run_id": "r_village_basic_1",
  "type": "browser.acted",
  "actor": "A_s1",
  "target": "B2",
  "level": "L1",
  "district": "D1",
  "item": null,
  "severity": "info",
  "credits": 1,
  "summary": "The Specialist browser step 5: click (refused).",
  "cause": null,
  "vis": "all",
  "authz": null,
  "data": {
    "session": "bs_01JB7A0000000000000000BRW1",
    "step": 5,
    "kind": "click",
    "verdict": "refused",
    "reason": "commit",
    "host": "shop.example.com",
    "chars": null,
    "masked": 0,
    "blocked": 1,
    "frame": {
      "artifact_id": "art_bs01JB7A0000000000000000BRW1_5",
      "version": 1
    }
  },
  "trace": {
    "model_role": "computer_use",
    "profile": "example-vision",
    "tokens_in": 1400,
    "tokens_out": 40,
    "tool": "browse_web",
    "latency_ms": 2100,
    "archive_ref": null
  }
}
