{
  "v": "1.0",
  "id": "01JB5VQ0000000000000000302",
  "seq": 302,
  "ts": "2026-10-05T09:05:02.000Z",
  "world_id": "w_desk_priya",
  "run_id": "r_desk_priya_1",
  "type": "work_item.created",
  "actor": "A_analyst",
  "target": "u_priya",
  "level": null,
  "district": null,
  "item": null,
  "severity": "info",
  "credits": 0,
  "summary": "A work item was proposed for Priya from the planning meeting.",
  "cause": null,
  "vis": "all",
  "authz": null,
  "data": {
    "work_item_id": "wi_rate_sheet",
    "owner": "u_priya",
    "status": "proposed",
    "source_kind": "meeting"
  },
  "trace": {
    "model_role": null,
    "profile": null,
    "tokens_in": null,
    "tokens_out": null,
    "tool": null,
    "latency_ms": null,
    "archive_ref": null
  }
}
