{
  "v": "1.0",
  "id": "01JB5VQ0000000000000000312",
  "seq": 312,
  "ts": "2026-10-05T09:05:12.000Z",
  "world_id": "w_desk_priya",
  "run_id": "r_desk_priya_1",
  "type": "assistant.replied",
  "actor": "system",
  "target": "u_priya",
  "level": null,
  "district": null,
  "item": null,
  "severity": "info",
  "credits": 0,
  "summary": "The assistant answered from the plate and the calendar.",
  "cause": null,
  "vis": "all",
  "authz": null,
  "data": {
    "conversation_id": "01JB5VQ0000000000000009311",
    "message_ref": "r_desk_priya_1/33",
    "outcome": "answered",
    "decided_by": "rules",
    "sources": [
      {
        "kind": "work_item",
        "id": "wi_rate_sheet"
      },
      {
        "kind": "calendar_entry",
        "id": "ce_followup_thu"
      }
    ],
    "ui_action": null,
    "cached": false
  },
  "trace": {
    "model_role": null,
    "profile": null,
    "tokens_in": null,
    "tokens_out": null,
    "tool": null,
    "latency_ms": null,
    "archive_ref": null
  }
}
