{
  "v": "1.0",
  "id": "01JB5VQ0000000000000000960",
  "seq": 2,
  "ts": "2026-10-08T09:00:00.000Z",
  "world_id": "w_desk_priya",
  "run_id": "r_desk_priya_1",
  "type": "team_rule.changed",
  "actor": "u_priya",
  "target": "u_priya",
  "level": null,
  "district": null,
  "item": null,
  "severity": "info",
  "credits": 0,
  "summary": "Priya turned on the weekend hold for scheduled work.",
  "cause": null,
  "vis": [],
  "authz": null,
  "data": {
    "rule": "switch",
    "key": "weekend",
    "from": "off",
    "to": "on"
  },
  "trace": {
    "model_role": null,
    "profile": null,
    "tokens_in": null,
    "tokens_out": null,
    "tool": null,
    "latency_ms": null,
    "archive_ref": null
  }
}
